{
 "schema": "szk.appraisal/v1",
 "tool": "rob2",
 "scope": "assignment",
 "instrument_sha256": "6a9c81e40d0a556220d18044e86bd118c2edbae9bb0afd075d81ae1fd5ad2c51",
 "target": {
  "unit": "NCT0456",
  "study_id": "NCT0456",
  "outcome": "o1",
  "result": "ITT 12 hó",
  "model": null,
  "index_test": null,
  "key": "o1"
 },
 "assessor": "SzK",
 "second_assessor": null,
 "status": "complete",
 "origin": "human",
 "approved_by": null,
 "approved_at": null,
 "answers": {
  "1.1": {
   "value": "yes",
   "evidence": {
    "text": "computer-generated random sequence",
    "doc": "pmid:1",
    "page": 3,
    "locator": null
   }
  },
  "1.2": {
   "value": "yes",
   "evidence": {
    "text": "computer-generated random sequence",
    "doc": "pmid:1",
    "page": 3,
    "locator": null
   }
  },
  "1.3": {
   "value": "no",
   "evidence": {
    "text": "computer-generated random sequence",
    "doc": "pmid:1",
    "page": 3,
    "locator": null
   }
  },
  "2.1": {
   "value": "yes",
   "evidence": {
    "text": "computer-generated random sequence",
    "doc": "pmid:1",
    "page": 3,
    "locator": null
   }
  },
  "2.2": {
   "value": "yes",
   "evidence": {
    "text": "computer-generated random sequence",
    "doc": "pmid:1",
    "page": 3,
    "locator": null
   }
  },
  "2.3": {
   "value": "yes",
   "evidence": {
    "text": "computer-generated random sequence",
    "doc": "pmid:1",
    "page": 3,
    "locator": null
   }
  },
  "2.4": {
   "value": "yes",
   "evidence": {
    "text": "computer-generated random sequence",
    "doc": "pmid:1",
    "page": 3,
    "locator": null
   }
  },
  "2.5": {
   "value": "yes",
   "evidence": {
    "text": "computer-generated random sequence",
    "doc": "pmid:1",
    "page": 3,
    "locator": null
   }
  },
  "2.6": {
   "value": "yes",
   "evidence": {
    "text": "computer-generated random sequence",
    "doc": "pmid:1",
    "page": 3,
    "locator": null
   }
  },
  "2.7": {
   "value": "no",
   "evidence": {
    "text": "computer-generated random sequence",
    "doc": "pmid:1",
    "page": 3,
    "locator": null
   }
  },
  "3.1": {
   "value": "yes",
   "evidence": {
    "text": "computer-generated random sequence",
    "doc": "pmid:1",
    "page": 3,
    "locator": null
   }
  },
  "3.2": {
   "value": "yes",
   "evidence": {
    "text": "computer-generated random sequence",
    "doc": "pmid:1",
    "page": 3,
    "locator": null
   }
  },
  "3.3": {
   "value": "yes",
   "evidence": {
    "text": "computer-generated random sequence",
    "doc": "pmid:1",
    "page": 3,
    "locator": null
   }
  },
  "3.4": {
   "value": "no",
   "evidence": {
    "text": "computer-generated random sequence",
    "doc": "pmid:1",
    "page": 3,
    "locator": null
   }
  },
  "4.1": {
   "value": "no",
   "evidence": {
    "text": "computer-generated random sequence",
    "doc": "pmid:1",
    "page": 3,
    "locator": null
   }
  },
  "4.2": {
   "value": "no",
   "evidence": {
    "text": "computer-generated random sequence",
    "doc": "pmid:1",
    "page": 3,
    "locator": null
   }
  },
  "4.3": {
   "value": "yes",
   "evidence": {
    "text": "computer-generated random sequence",
    "doc": "pmid:1",
    "page": 3,
    "locator": null
   }
  },
  "4.4": {
   "value": "yes",
   "evidence": {
    "text": "computer-generated random sequence",
    "doc": "pmid:1",
    "page": 3,
    "locator": null
   }
  },
  "4.5": {
   "value": "no",
   "evidence": {
    "text": "computer-generated random sequence",
    "doc": "pmid:1",
    "page": 3,
    "locator": null
   }
  },
  "5.1": {
   "value": "yes",
   "evidence": {
    "text": "computer-generated random sequence",
    "doc": "pmid:1",
    "page": 3,
    "locator": null
   }
  },
  "5.2": {
   "value": "no",
   "evidence": {
    "text": "computer-generated random sequence",
    "doc": "pmid:1",
    "page": 3,
    "locator": null
   }
  },
  "5.3": {
   "value": "no",
   "evidence": {
    "text": "computer-generated random sequence",
    "doc": "pmid:1",
    "page": 3,
    "locator": null
   }
  }
 },
 "domain_judgements": [
  {
   "domain": "1",
   "pass": null,
   "judgement": "low",
   "implied": "low",
   "rationale": "nincs jelzés",
   "override_reason": null,
   "decision_id": null
  },
  {
   "domain": "2",
   "pass": null,
   "judgement": "low",
   "implied": "low",
   "rationale": "nincs jelzés",
   "override_reason": null,
   "decision_id": null
  },
  {
   "domain": "3",
   "pass": null,
   "judgement": "low",
   "implied": "low",
   "rationale": "nincs jelzés",
   "override_reason": null,
   "decision_id": null
  },
  {
   "domain": "4",
   "pass": null,
   "judgement": "low",
   "implied": "low",
   "rationale": "nincs jelzés",
   "override_reason": null,
   "decision_id": null
  },
  {
   "domain": "5",
   "pass": null,
   "judgement": "low",
   "implied": "low",
   "rationale": "nincs jelzés",
   "override_reason": null,
   "decision_id": null
  }
 ],
 "applicability": [],
 "overall": {
  "judgement": "low",
  "rationale": "minden domén alacsony",
  "implied": "low",
  "override_reason": null,
  "decision_id": null
 },
 "engine_version": "0.1.0",
 "created": "2026-10-05T10:00:00Z",
 "updated": "2026-10-05T10:00:00Z"
}
